{
  "artifact_status": "candidate_unapproved",
  "semantic_approval": false,
  "span_convention": "zero-based UTF-8 byte offsets, start inclusive, end exclusive",
  "receipts": [
    {
      "id": "ecfr-774-9A012-heading",
      "candidate_for": ["CCL-9A012.a.1", "CCL-9A012.a.2", "CCL-9A012.a.3"],
      "repository_file": "data/ecfr/title-15-part-774-2026-09-01.xml",
      "sha256": "c60be9cd7da59aa8e5cca3bce8a3938bd40d79f7aec5f3a3fb4c7c40e818b51f",
      "raw_span": [1835164, 1835384],
      "raw_span_sha256": "8170bf855231e7dca61b65a6249928e248c1406f4be7aa2d4d8a6ebb9e9d1265",
      "normalized_display_text": "9A012 “Unmanned Aerial Vehicles,” (“UAVs”), unmanned “airships”, related equipment and “components”, as follows (see List of Items Controlled).",
      "content_date": "2026-09-01",
      "url": "https://www.ecfr.gov/current/title-15/part-774",
      "approval": "unapproved_candidate"
    },
    {
      "id": "ecfr-774-9A012-reason-summary",
      "candidate_for": ["CCL-9A012.a.1", "CCL-9A012.a.2", "CCL-9A012.a.3"],
      "repository_file": "data/ecfr/title-15-part-774-2026-09-01.xml",
      "sha256": "c60be9cd7da59aa8e5cca3bce8a3938bd40d79f7aec5f3a3fb4c7c40e818b51f",
      "raw_span": [1835434, 1835485],
      "raw_span_sha256": "936a87ec56caca8a04c27f3adc567ca1878476689dd3f10fc34729d51ab46bfa",
      "normalized_display_text": "Reason for Control: NS, MT, AT",
      "content_date": "2026-09-01",
      "url": "https://www.ecfr.gov/current/title-15/part-774",
      "approval": "unapproved_candidate"
    },
    {
      "id": "ecfr-774-9A012-ns-row",
      "candidate_for": ["CCL-9A012.a.1", "CCL-9A012.a.2", "CCL-9A012.a.3"],
      "repository_file": "data/ecfr/title-15-part-774-2026-09-01.xml",
      "sha256": "c60be9cd7da59aa8e5cca3bce8a3938bd40d79f7aec5f3a3fb4c7c40e818b51f",
      "raw_span": [1835876, 1835957],
      "raw_span_sha256": "f0a1349889331090e782cb2f8425df0e5ece05e89685002353f9304e046b54e6",
      "normalized_display_text": "NS applies to entire entry, except .a.1",
      "content_date": "2026-09-01",
      "url": "https://www.ecfr.gov/current/title-15/part-774",
      "approval": "unapproved_candidate"
    },
    {
      "id": "ecfr-774-9A012-at-row",
      "candidate_for": ["CCL-9A012.a.1", "CCL-9A012.a.2", "CCL-9A012.a.3"],
      "repository_file": "data/ecfr/title-15-part-774-2026-09-01.xml",
      "sha256": "c60be9cd7da59aa8e5cca3bce8a3938bd40d79f7aec5f3a3fb4c7c40e818b51f",
      "raw_span": [1836360, 1836449],
      "raw_span_sha256": "07a46e008f2b1e6ee465d896784a84abf2b2f7ba80c2a4f4f17535c34d255f25",
      "normalized_display_text": "AT applies to entire entry",
      "content_date": "2026-09-01",
      "url": "https://www.ecfr.gov/current/title-15/part-774",
      "approval": "unapproved_candidate"
    },
    {
      "id": "ecfr-774-9A012-a-chapeau",
      "candidate_for": ["CCL-9A012.a.1", "CCL-9A012.a.2", "CCL-9A012.a.3"],
      "repository_file": "data/ecfr/title-15-part-774-2026-09-01.xml",
      "sha256": "c60be9cd7da59aa8e5cca3bce8a3938bd40d79f7aec5f3a3fb4c7c40e818b51f",
      "raw_span": [1837535, 1837731],
      "raw_span_sha256": "ff89b7f79a3da557d9f6c91b5bea6ab14a9d8a836e76fd03d2e9717533d34fef",
      "normalized_display_text": "a. “UAVs” or unmanned “airships”, designed to have controlled flight out of the direct 'natural vision' of the 'operator' and having any of the following:",
      "content_date": "2026-09-01",
      "url": "https://www.ecfr.gov/current/title-15/part-774",
      "approval": "unapproved_candidate"
    },
    {
      "id": "ecfr-774-9A012-a1",
      "candidate_for": ["CCL-9A012.a.1"],
      "repository_file": "data/ecfr/title-15-part-774-2026-09-01.xml",
      "sha256": "c60be9cd7da59aa8e5cca3bce8a3938bd40d79f7aec5f3a3fb4c7c40e818b51f",
      "raw_span": [1837732, 1837784],
      "raw_span_sha256": "fc8aae6116915056ab92f90791ad6dbeafb390dabf712790f916b12b6874d2a0",
      "normalized_display_text": "a.1. A maximum 'endurance' less than 3 hours;",
      "content_date": "2026-09-01",
      "url": "https://www.ecfr.gov/current/title-15/part-774",
      "approval": "unapproved_candidate"
    },
    {
      "id": "ecfr-774-9A012-a2",
      "candidate_for": ["CCL-9A012.a.2"],
      "repository_file": "data/ecfr/title-15-part-774-2026-09-01.xml",
      "sha256": "c60be9cd7da59aa8e5cca3bce8a3938bd40d79f7aec5f3a3fb4c7c40e818b51f",
      "raw_span": [1837785, 1837841],
      "raw_span_sha256": "5a5cb4fbad7a8e84759c599888397c1197408f7c7b294cc0401a990d65359c6c",
      "normalized_display_text": "a.2. A maximum 'endurance' of 3 hours or greater;",
      "content_date": "2026-09-01",
      "url": "https://www.ecfr.gov/current/title-15/part-774",
      "approval": "unapproved_candidate"
    },
    {
      "id": "ecfr-774-9A012-a3",
      "candidate_for": ["CCL-9A012.a.3"],
      "repository_file": "data/ecfr/title-15-part-774-2026-09-01.xml",
      "sha256": "c60be9cd7da59aa8e5cca3bce8a3938bd40d79f7aec5f3a3fb4c7c40e818b51f",
      "raw_span": [1837842, 1837991],
      "raw_span_sha256": "5281dea710ce689c8da668752f290d93f1baac8a0620776a6fa8e2633833ec78",
      "normalized_display_text": "a.3. “UAVs” or unmanned “airships” incorporating items specified in ECCN 6A003.b.3, 6A003.b.4.b, or 6A008.d to .h;",
      "content_date": "2026-09-01",
      "url": "https://www.ecfr.gov/current/title-15/part-774",
      "approval": "unapproved_candidate"
    },
    {
      "id": "ecfr-774-9A012-a5",
      "candidate_for": ["CCL-9A012.a.5"],
      "repository_file": "data/ecfr/title-15-part-774-2026-09-01.xml",
      "sha256": "c60be9cd7da59aa8e5cca3bce8a3938bd40d79f7aec5f3a3fb4c7c40e818b51f",
      "raw_span": [1838110, 1838331],
      "raw_span_sha256": "b81c58cd19742986858446c2b8b7d08296a214513aa653fe8b529393d10c64d9",
      "normalized_display_text": "a.5. “UAVs” or unmanned “airships” incorporating “inertial measurement equipment or systems” using accelerometers or gyros specified in ECCNs 7A001, 7A002, 7A003, or 7A005.",
      "content_date": "2026-09-01",
      "url": "https://www.ecfr.gov/current/title-15/part-774",
      "approval": "unapproved_candidate"
    },
    {
      "id": "ecfr-774-9A012-technical-note-operator",
      "candidate_for": ["CCL-9A012.a.1", "CCL-9A012.a.2", "CCL-9A012.a.3"],
      "repository_file": "data/ecfr/title-15-part-774-2026-09-01.xml",
      "sha256": "c60be9cd7da59aa8e5cca3bce8a3938bd40d79f7aec5f3a3fb4c7c40e818b51f",
      "raw_span": [1838374, 1838536],
      "raw_span_sha256": "9b50a79711313e44c205121d53fb477142f610cd31ca8ebebacf3e0284a4e324",
      "normalized_display_text": "1. For the purposes of 9A012.a, 'operator' is a person who initiates or commands the “UAV” or unmanned “airship” flight.",
      "content_date": "2026-09-01",
      "url": "https://www.ecfr.gov/current/title-15/part-774",
      "approval": "unapproved_candidate"
    },
    {
      "id": "ecfr-774-9A012-technical-note-endurance",
      "candidate_for": ["CCL-9A012.a.1", "CCL-9A012.a.2"],
      "repository_file": "data/ecfr/title-15-part-774-2026-09-01.xml",
      "sha256": "c60be9cd7da59aa8e5cca3bce8a3938bd40d79f7aec5f3a3fb4c7c40e818b51f",
      "raw_span": [1838537, 1838676],
      "raw_span_sha256": "ce89b3be02020a4760cceb09932789cade75e43b9d5f6926455e7b8b838214d1",
      "normalized_display_text": "2. For the purposes of 9A012.a, 'endurance' is to be calculated for ISA conditions (ISO 2533:1975) at sea level in zero wind.",
      "content_date": "2026-09-01",
      "url": "https://www.ecfr.gov/current/title-15/part-774",
      "approval": "unapproved_candidate"
    },
    {
      "id": "ecfr-774-9A012-technical-note-natural-vision",
      "candidate_for": ["CCL-9A012.a.1", "CCL-9A012.a.2", "CCL-9A012.a.3"],
      "repository_file": "data/ecfr/title-15-part-774-2026-09-01.xml",
      "sha256": "c60be9cd7da59aa8e5cca3bce8a3938bd40d79f7aec5f3a3fb4c7c40e818b51f",
      "raw_span": [1838677, 1838801],
      "raw_span_sha256": "5b38e8bc2c5e57cced7175592f5d583f47c37efc8f7e98581ca1c6832e712bd7",
      "normalized_display_text": "3. For the purposes of 9A012.a, 'natural vision' means unaided human sight, with or without corrective lenses.",
      "content_date": "2026-09-01",
      "url": "https://www.ecfr.gov/current/title-15/part-774",
      "approval": "unapproved_candidate"
    },
    {
      "id": "ecfr-774-6A003-rs-column-1-row",
      "candidate_for": ["CCL-6A003.b.4.b-RS1"],
      "repository_file": "data/ecfr/title-15-part-774-2026-09-01.xml",
      "sha256": "c60be9cd7da59aa8e5cca3bce8a3938bd40d79f7aec5f3a3fb4c7c40e818b51f",
      "raw_span": [1431019, 1431425],
      "raw_span_sha256": "b6b0113d03688f1bb95eb99f6dce384e7f9f5ec9ba8db41a2cc2dd22717bbce4",
      "normalized_display_text": "RS applies to 6A003.b.3, 6A003.b.4.a, 6A003.b.4.c and to items controlled in 6A003.b.4.b that have a frame rate greater than 60 Hz or that incorporate a focal plane array with more than 111,000 elements, or to items in 6A003.b.4.b when being exported or reexported to be embedded in a civil product. (But see § 742.6(a)(2)(iii) and (v) for certain exemptions)",
      "content_date": "2026-09-01",
      "url": "https://www.ecfr.gov/current/title-15/part-774",
      "approval": "unapproved_candidate"
    },
    {
      "id": "ecfr-774-6A003-rs-column-2-row",
      "candidate_for": ["CCL-6A003.b.4.b-RS2"],
      "repository_file": "data/ecfr/title-15-part-774-2026-09-01.xml",
      "sha256": "c60be9cd7da59aa8e5cca3bce8a3938bd40d79f7aec5f3a3fb4c7c40e818b51f",
      "raw_span": [1431471, 1431745],
      "raw_span_sha256": "dc7bb0328bb1deb846071d1f03d1bb6d57b4addf88191bc056ac1c932c938d23",
      "normalized_display_text": "RS applies to items controlled in 6A003.b.4.b that have a frame rate of 60 Hz or less and that incorporate a focal plane array with not more than 111,000 elements if not being exported or reexported to be embedded in a civil product",
      "content_date": "2026-09-01",
      "url": "https://www.ecfr.gov/current/title-15/part-774",
      "approval": "unapproved_candidate"